{
  "id": "I182625987709",
  "name": {
    "given": "Sir Edmund",
    "surname": "Degrey, Baron Grey Of Wilton",
    "suffix": null,
    "full": "Sir Edmund Degrey, Baron Grey Of Wilton"
  },
  "sex": "M",
  "vitals": {
    "birth": {
      "type": "birth",
      "date": {
        "raw": "1469",
        "year": 1469,
        "year_end": null,
        "qualifier": null
      },
      "place": {
        "raw": "Wilton Castle, Herefordshire, England 1666735",
        "parts": [
          "Wilton Castle",
          "Herefordshire",
          "England 1666735"
        ]
      },
      "value": null,
      "note": null,
      "sources": [],
      "confidence": "inferred"
    },
    "death": {
      "type": "death",
      "date": {
        "raw": "5 May 1511",
        "year": 1511,
        "year_end": null,
        "qualifier": null
      },
      "place": {
        "raw": "Hereford, Herefordshire, England",
        "parts": [
          "Hereford",
          "Herefordshire",
          "England"
        ]
      },
      "value": null,
      "note": null,
      "sources": [],
      "confidence": "inferred"
    }
  },
  "relationships": {
    "parents": [],
    "spouses": [
      {
        "id": "I182625987711"
      }
    ],
    "children": [
      "I182625987633"
    ]
  },
  "events": [],
  "sources": [],
  "notes": [],
  "confidence": "inferred"
}
