{
  "id": "I182613112314",
  "name": {
    "given": "Thomas",
    "surname": "Beal",
    "suffix": null,
    "full": "Thomas Beal"
  },
  "sex": "M",
  "vitals": {
    "birth": {
      "type": "birth",
      "date": {
        "raw": "15 Mar 1671/72",
        "year": 1671,
        "year_end": null,
        "qualifier": null
      },
      "place": {
        "raw": "Hingham, Massachusetts",
        "parts": [
          "Hingham",
          "Massachusetts"
        ]
      },
      "value": null,
      "note": null,
      "sources": [],
      "confidence": "inferred"
    },
    "death": {
      "type": "death",
      "date": {
        "raw": "14 Sep 1751",
        "year": 1751,
        "year_end": null,
        "qualifier": null
      },
      "place": {
        "raw": "Newton, Middlesex, Colony of Massachusetts British Colonial America",
        "parts": [
          "Newton",
          "Middlesex",
          "Colony of Massachusetts British Colonial America"
        ]
      },
      "value": null,
      "note": null,
      "sources": [],
      "confidence": "inferred"
    }
  },
  "relationships": {
    "parents": [],
    "spouses": [
      {
        "id": "I182613112312"
      }
    ],
    "children": [
      "I182613112304"
    ]
  },
  "events": [
    {
      "type": "birth",
      "date": {
        "raw": "15 Aug 1671",
        "year": 1671,
        "year_end": null,
        "qualifier": null
      },
      "place": {
        "raw": "Hingham, Massachusetts",
        "parts": [
          "Hingham",
          "Massachusetts"
        ]
      },
      "value": null,
      "note": null,
      "sources": [],
      "confidence": "inferred"
    }
  ],
  "sources": [],
  "notes": [],
  "confidence": "inferred"
}
