{
  "id": "I182198565593",
  "name": {
    "given": "Dominic J",
    "surname": "Prosper",
    "suffix": null,
    "full": "Dominic J Prosper"
  },
  "sex": "M",
  "vitals": {
    "birth": {
      "type": "birth",
      "date": {
        "raw": "abt 1910",
        "year": 1910,
        "year_end": null,
        "qualifier": "ABT"
      },
      "place": {
        "raw": "Massachusetts",
        "parts": [
          "Massachusetts"
        ]
      },
      "value": null,
      "note": null,
      "sources": [
        {
          "source_id": "S447147190",
          "page": null
        },
        {
          "source_id": "S447115653",
          "page": "Year: 1930; Census Place: Brockton, Plymouth, Massachusetts; Page: 9A; Enumeration District: 0013; FHL microfilm: 2340673"
        },
        {
          "source_id": "S447116012",
          "page": null
        }
      ],
      "confidence": "documented"
    }
  },
  "relationships": {
    "parents": [
      "I182198562830",
      "I182198562868"
    ],
    "spouses": [],
    "children": []
  },
  "events": [
    {
      "type": "residence",
      "date": {
        "raw": "1910",
        "year": 1910,
        "year_end": null,
        "qualifier": null
      },
      "place": {
        "raw": "Brockton Ward 1, Plymouth, Massachusetts, USA",
        "parts": [
          "Brockton Ward 1",
          "Plymouth",
          "Massachusetts",
          "USA"
        ]
      },
      "value": null,
      "note": "Marital Status: Single; Relation to Head of House: Son",
      "sources": [
        {
          "source_id": "S447116012",
          "page": null
        }
      ],
      "confidence": "documented"
    },
    {
      "type": "residence",
      "date": {
        "raw": "1920",
        "year": 1920,
        "year_end": null,
        "qualifier": null
      },
      "place": {
        "raw": "Brockton Ward 1, Plymouth, Massachusetts, USA",
        "parts": [
          "Brockton Ward 1",
          "Plymouth",
          "Massachusetts",
          "USA"
        ]
      },
      "value": null,
      "note": "Marital Status: Single; Relation to Head: Son",
      "sources": [
        {
          "source_id": "S447147190",
          "page": null
        }
      ],
      "confidence": "documented"
    },
    {
      "type": "residence",
      "date": {
        "raw": "1930",
        "year": 1930,
        "year_end": null,
        "qualifier": null
      },
      "place": {
        "raw": "Brockton, Plymouth, Massachusetts, USA",
        "parts": [
          "Brockton",
          "Plymouth",
          "Massachusetts",
          "USA"
        ]
      },
      "value": null,
      "note": "Marital Status: Single; Relation to Head: Son",
      "sources": [
        {
          "source_id": "S447115653",
          "page": "Year: 1930; Census Place: Brockton, Plymouth, Massachusetts; Page: 9A; Enumeration District: 0013; FHL microfilm: 2340673"
        }
      ],
      "confidence": "documented"
    }
  ],
  "sources": [
    {
      "id": "S447147190",
      "title": "1920 United States Federal Census",
      "author": "Ancestry.com",
      "publication": "Ancestry.com Operations, Inc.",
      "repository": "@R404210260@"
    },
    {
      "id": "S447115653",
      "title": "1930 United States Federal Census",
      "author": "Ancestry.com",
      "publication": "Ancestry.com Operations Inc",
      "repository": "@R404210260@"
    },
    {
      "id": "S447116012",
      "title": "1910 United States Federal Census",
      "author": "Ancestry.com",
      "publication": "Ancestry.com Operations Inc",
      "repository": "@R404210260@"
    }
  ],
  "notes": [],
  "confidence": "documented"
}
