{
  "id": "I182613112746",
  "name": {
    "given": "Sir Richard Edward Cooke",
    "surname": null,
    "suffix": null,
    "full": "Sir Richard Edward Cooke"
  },
  "sex": "M",
  "vitals": {
    "birth": {
      "type": "birth",
      "date": {
        "raw": "1525",
        "year": 1525,
        "year_end": null,
        "qualifier": null
      },
      "place": {
        "raw": "England",
        "parts": [
          "England"
        ]
      },
      "value": null,
      "note": null,
      "sources": [],
      "confidence": "inferred"
    },
    "death": {
      "type": "death",
      "date": {
        "raw": "1579",
        "year": 1579,
        "year_end": null,
        "qualifier": null
      },
      "place": {
        "raw": "England",
        "parts": [
          "England"
        ]
      },
      "value": null,
      "note": null,
      "sources": [],
      "confidence": "inferred"
    }
  },
  "relationships": {
    "parents": [],
    "spouses": [],
    "children": [
      "I182613112739"
    ]
  },
  "events": [],
  "sources": [],
  "notes": [],
  "confidence": "inferred"
}
