{
  "id": "I182620325132",
  "name": {
    "given": "Cecily Dabridgecourt",
    "surname": "Mansfield\\Mansell,",
    "suffix": "Attendant to Queen Mary",
    "full": "Cecily Dabridgecourt Mansfield\\Mansell, Attendant to Queen Mary"
  },
  "sex": "F",
  "vitals": {
    "birth": {
      "type": "birth",
      "date": {
        "raw": "1506",
        "year": 1506,
        "year_end": null,
        "qualifier": null
      },
      "place": {
        "raw": "Margam, Glamorgan, Wales",
        "parts": [
          "Margam",
          "Glamorgan",
          "Wales"
        ]
      },
      "value": null,
      "note": null,
      "sources": [
        {
          "source_id": "S514024035",
          "page": null
        },
        {
          "source_id": "S516008889",
          "page": null
        }
      ],
      "confidence": "documented"
    },
    "death": {
      "type": "death",
      "date": {
        "raw": "20 Sep 1558",
        "year": 1558,
        "year_end": null,
        "qualifier": null
      },
      "place": {
        "raw": "London, London, England",
        "parts": [
          "London",
          "London",
          "England"
        ]
      },
      "value": null,
      "note": null,
      "sources": [
        {
          "source_id": "S516008889",
          "page": null
        }
      ],
      "confidence": "documented"
    },
    "burial": {
      "type": "burial",
      "date": null,
      "place": {
        "raw": "London, City of London, Greater London, England",
        "parts": [
          "London",
          "City of London",
          "Greater London",
          "England"
        ]
      },
      "value": null,
      "note": null,
      "sources": [
        {
          "source_id": "S516008889",
          "page": null
        }
      ],
      "confidence": "documented"
    }
  },
  "relationships": {
    "parents": [
      "I182620327459",
      "I182620327460"
    ],
    "spouses": [
      {
        "id": "I182620325139"
      }
    ],
    "children": [
      "I182620335532",
      "I182620325097",
      "I182620335534",
      "I182620328363",
      "I182620328364",
      "I182620328366"
    ]
  },
  "events": [
    {
      "type": "death",
      "date": {
        "raw": "20 Sep 1558",
        "year": 1558,
        "year_end": null,
        "qualifier": null
      },
      "place": {
        "raw": "London, Middlesex, England Is",
        "parts": [
          "London",
          "Middlesex",
          "England Is"
        ]
      },
      "value": null,
      "note": null,
      "sources": [],
      "confidence": "inferred"
    }
  ],
  "sources": [
    {
      "id": "S514024035",
      "title": "Web: Netherlands, GenealogieOnline Trees Index, 1000-2015",
      "author": "Ancestry.com",
      "publication": "Ancestry.com Operations, Inc.",
      "repository": null
    },
    {
      "id": "S516008889",
      "title": "UK and Ireland, Find a Grave® Index, 1300s-Current",
      "author": "Ancestry.com",
      "publication": "Ancestry.com Operations, Inc.",
      "repository": null
    },
    {
      "id": "S516620590",
      "title": "U.S., Cemetery and Funeral Home Collection, 1847-Current",
      "author": "Ancestry.com",
      "publication": "Ancestry.com Operations Inc",
      "repository": null
    },
    {
      "id": "S516620328",
      "title": "Penrice Castle and Margam Abbey, Wales and England Manuscripts",
      "author": "Ancestry.com",
      "publication": "Ancestry.com Operations Inc",
      "repository": "@R404210260@"
    }
  ],
  "notes": [],
  "confidence": "documented",
  "manual": {
    "notes": [
      "OPEN QUESTION — DAUGHTER NOT AMONG ATTESTED CHILDREN (deep-chain audit, 2026-07-03): 'Cecily Dabridgecourt Mansfield/Mansell, Attendant to Queen Mary' is listed here as a daughter of Sir Giles Brugge/Brydges, 6th Baron Chandos (I182620327459) and Isabel Baynham (I182620327460) — a solidly documented English peerage couple — but she is not found among Giles's attested daughters (Florence, Anne, Ursula) in thepeerage.com or Wikipedia. Could be a lesser-documented daughter, a different Brydges-family Cecily, or a misattachment; needs further research before treating as confirmed. — thepeerage.com p10287; Wikipedia: Giles Brugge, 6th Baron Chandos."
    ]
  }
}
