{
  "id": "I182613113511",
  "name": {
    "given": "John",
    "surname": "Wellington",
    "suffix": null,
    "full": "John Wellington"
  },
  "sex": "M",
  "vitals": {
    "birth": {
      "type": "birth",
      "date": {
        "raw": "26 Jul 1678",
        "year": 1678,
        "year_end": null,
        "qualifier": null
      },
      "place": {
        "raw": "Watertown, Middlesex, Massachusetts, USA",
        "parts": [
          "Watertown",
          "Middlesex",
          "Massachusetts",
          "USA"
        ]
      },
      "value": null,
      "note": null,
      "sources": [],
      "confidence": "inferred"
    },
    "death": {
      "type": "death",
      "date": {
        "raw": "November 30, 1717",
        "year": 1717,
        "year_end": null,
        "qualifier": null
      },
      "place": {
        "raw": "Lexington, Massachusetts",
        "parts": [
          "Lexington",
          "Massachusetts"
        ]
      },
      "value": null,
      "note": null,
      "sources": [],
      "confidence": "inferred"
    }
  },
  "relationships": {
    "parents": [],
    "spouses": [
      {
        "id": "I182613113509"
      }
    ],
    "children": [
      "I182613112524"
    ]
  },
  "events": [],
  "sources": [],
  "notes": [],
  "confidence": "inferred"
}
